<?xml version="1.0" encoding="UTF-8"?>
<constraints__pressure xmlns:xsi="http://www.w3.org/2001/XMLSchema-instance" xsi:noNamespaceSchemaLocation="../../../settings_schema/xsd/equilibrium/constraints_pressure.xsd">
    <pressure>
        <include>false</include>
        <sensor_name_prefix>PRESSURE</sensor_name_prefix>
        <expected_value>2000.0</expected_value>
        <weight>10.0</weight>
        <comment>Thomson scattering electron pressure, scaled to total pressure</comment>
        <thomson_scattering>
            <pressure_multiplier>2.0</pressure_multiplier>
            <minimum_pressure>500.0</minimum_pressure>
        </thomson_scattering>
    </pressure>
</constraints__pressure>
